[
  {
    "section_id": "intro",
    "section_type": "intro",
    "round": null,
    "learning_objective": "transition",
    "letters": [],
    "line_count": 2,
    "rhyme_scheme": "refrain-driven",
    "motif_id": "season-wheel-intro",
    "energy_level": "medium",
    "response_frame": null,
    "refrain_or_chorus_identity": null,
    "tempo_bpm": 88,
    "density_override_evidence": null,
    "notes": "Introduce theme and participation grammar without adding a second curriculum target."
  },
  {
    "section_id": "r1-a-d",
    "section_type": "verse",
    "round": 1,
    "learning_objective": "lexical-semantic",
    "letters": [
      "A",
      "B",
      "C",
      "D"
    ],
    "line_count": 4,
    "rhyme_scheme": "refrain-driven",
    "motif_id": "season-wheel-teach",
    "energy_level": "medium",
    "response_frame": null,
    "refrain_or_chorus_identity": null,
    "tempo_bpm": 88,
    "density_override_evidence": null,
    "notes": "Target word remains clear and early."
  },
  {
    "section_id": "r1-e-h",
    "section_type": "verse",
    "round": 1,
    "learning_objective": "lexical-semantic",
    "letters": [
      "E",
      "F",
      "G",
      "H"
    ],
    "line_count": 4,
    "rhyme_scheme": "refrain-driven",
    "motif_id": "season-wheel-teach",
    "energy_level": "medium",
    "response_frame": null,
    "refrain_or_chorus_identity": null,
    "tempo_bpm": 88,
    "density_override_evidence": null,
    "notes": "Target word remains clear and early."
  },
  {
    "section_id": "chorus-r1-2",
    "section_type": "chorus",
    "round": 1,
    "learning_objective": "verbatim-sequence",
    "letters": [],
    "line_count": 2,
    "rhyme_scheme": "paired",
    "motif_id": "season-wheel-hook",
    "energy_level": "high",
    "response_frame": null,
    "refrain_or_chorus_identity": "hook-0196",
    "tempo_bpm": 88,
    "density_override_evidence": null,
    "notes": "Exact hook text repeats to strengthen song identity."
  },
  {
    "section_id": "r1-i-l",
    "section_type": "verse",
    "round": 1,
    "learning_objective": "lexical-semantic",
    "letters": [
      "I",
      "J",
      "K",
      "L"
    ],
    "line_count": 4,
    "rhyme_scheme": "refrain-driven",
    "motif_id": "season-wheel-teach",
    "energy_level": "medium",
    "response_frame": null,
    "refrain_or_chorus_identity": null,
    "tempo_bpm": 88,
    "density_override_evidence": null,
    "notes": "Target word remains clear and early."
  },
  {
    "section_id": "r1-m-p",
    "section_type": "verse",
    "round": 1,
    "learning_objective": "lexical-semantic",
    "letters": [
      "M",
      "N",
      "O",
      "P"
    ],
    "line_count": 4,
    "rhyme_scheme": "refrain-driven",
    "motif_id": "season-wheel-teach",
    "energy_level": "medium",
    "response_frame": null,
    "refrain_or_chorus_identity": null,
    "tempo_bpm": 88,
    "density_override_evidence": null,
    "notes": "Target word remains clear and early."
  },
  {
    "section_id": "chorus-r1-4",
    "section_type": "chorus",
    "round": 1,
    "learning_objective": "verbatim-sequence",
    "letters": [],
    "line_count": 2,
    "rhyme_scheme": "paired",
    "motif_id": "season-wheel-hook",
    "energy_level": "high",
    "response_frame": null,
    "refrain_or_chorus_identity": "hook-0196",
    "tempo_bpm": 88,
    "density_override_evidence": null,
    "notes": "Exact hook text repeats to strengthen song identity."
  },
  {
    "section_id": "r1-q-t",
    "section_type": "verse",
    "round": 1,
    "learning_objective": "lexical-semantic",
    "letters": [
      "Q",
      "R",
      "S",
      "T"
    ],
    "line_count": 4,
    "rhyme_scheme": "refrain-driven",
    "motif_id": "season-wheel-teach",
    "energy_level": "medium",
    "response_frame": null,
    "refrain_or_chorus_identity": null,
    "tempo_bpm": 88,
    "density_override_evidence": null,
    "notes": "Target word remains clear and early."
  },
  {
    "section_id": "r1-u-x",
    "section_type": "verse",
    "round": 1,
    "learning_objective": "lexical-semantic",
    "letters": [
      "U",
      "V",
      "W",
      "X"
    ],
    "line_count": 4,
    "rhyme_scheme": "refrain-driven",
    "motif_id": "season-wheel-teach",
    "energy_level": "medium",
    "response_frame": null,
    "refrain_or_chorus_identity": null,
    "tempo_bpm": 88,
    "density_override_evidence": null,
    "notes": "Target word remains clear and early."
  },
  {
    "section_id": "chorus-r1-6",
    "section_type": "chorus",
    "round": 1,
    "learning_objective": "verbatim-sequence",
    "letters": [],
    "line_count": 2,
    "rhyme_scheme": "paired",
    "motif_id": "season-wheel-hook",
    "energy_level": "high",
    "response_frame": null,
    "refrain_or_chorus_identity": "hook-0196",
    "tempo_bpm": 88,
    "density_override_evidence": null,
    "notes": "Exact hook text repeats to strengthen song identity."
  },
  {
    "section_id": "r1-y-z",
    "section_type": "verse",
    "round": 1,
    "learning_objective": "lexical-semantic",
    "letters": [
      "Y",
      "Z"
    ],
    "line_count": 2,
    "rhyme_scheme": "refrain-driven",
    "motif_id": "season-wheel-teach",
    "energy_level": "medium",
    "response_frame": null,
    "refrain_or_chorus_identity": null,
    "tempo_bpm": 88,
    "density_override_evidence": null,
    "notes": "Target word remains clear and early."
  },
  {
    "section_id": "r2-a-d",
    "section_type": "verse",
    "round": 2,
    "learning_objective": "retrieval-action",
    "letters": [
      "A",
      "B",
      "C",
      "D"
    ],
    "line_count": 4,
    "rhyme_scheme": "refrain-driven",
    "motif_id": "season-wheel-retrieve",
    "energy_level": "medium-high",
    "response_frame": "one to two predictable beats of retrieval space before target confirmation",
    "refrain_or_chorus_identity": null,
    "tempo_bpm": 88,
    "density_override_evidence": null,
    "notes": "Letter cue precedes target; object reveal waits for target-word onset."
  },
  {
    "section_id": "r2-e-h",
    "section_type": "verse",
    "round": 2,
    "learning_objective": "retrieval-action",
    "letters": [
      "E",
      "F",
      "G",
      "H"
    ],
    "line_count": 4,
    "rhyme_scheme": "refrain-driven",
    "motif_id": "season-wheel-retrieve",
    "energy_level": "medium-high",
    "response_frame": "one to two predictable beats of retrieval space before target confirmation",
    "refrain_or_chorus_identity": null,
    "tempo_bpm": 88,
    "density_override_evidence": null,
    "notes": "Letter cue precedes target; object reveal waits for target-word onset."
  },
  {
    "section_id": "chorus-r2-2",
    "section_type": "chorus",
    "round": 2,
    "learning_objective": "verbatim-sequence",
    "letters": [],
    "line_count": 2,
    "rhyme_scheme": "paired",
    "motif_id": "season-wheel-hook",
    "energy_level": "high",
    "response_frame": null,
    "refrain_or_chorus_identity": "hook-0196",
    "tempo_bpm": 88,
    "density_override_evidence": null,
    "notes": "Exact hook text repeats to strengthen song identity."
  },
  {
    "section_id": "r2-i-l",
    "section_type": "verse",
    "round": 2,
    "learning_objective": "retrieval-action",
    "letters": [
      "I",
      "J",
      "K",
      "L"
    ],
    "line_count": 4,
    "rhyme_scheme": "refrain-driven",
    "motif_id": "season-wheel-retrieve",
    "energy_level": "medium-high",
    "response_frame": "one to two predictable beats of retrieval space before target confirmation",
    "refrain_or_chorus_identity": null,
    "tempo_bpm": 88,
    "density_override_evidence": null,
    "notes": "Letter cue precedes target; object reveal waits for target-word onset."
  },
  {
    "section_id": "r2-m-p",
    "section_type": "verse",
    "round": 2,
    "learning_objective": "retrieval-action",
    "letters": [
      "M",
      "N",
      "O",
      "P"
    ],
    "line_count": 4,
    "rhyme_scheme": "refrain-driven",
    "motif_id": "season-wheel-retrieve",
    "energy_level": "medium-high",
    "response_frame": "one to two predictable beats of retrieval space before target confirmation",
    "refrain_or_chorus_identity": null,
    "tempo_bpm": 88,
    "density_override_evidence": null,
    "notes": "Letter cue precedes target; object reveal waits for target-word onset."
  },
  {
    "section_id": "chorus-r2-4",
    "section_type": "chorus",
    "round": 2,
    "learning_objective": "verbatim-sequence",
    "letters": [],
    "line_count": 2,
    "rhyme_scheme": "paired",
    "motif_id": "season-wheel-hook",
    "energy_level": "high",
    "response_frame": null,
    "refrain_or_chorus_identity": "hook-0196",
    "tempo_bpm": 88,
    "density_override_evidence": null,
    "notes": "Exact hook text repeats to strengthen song identity."
  },
  {
    "section_id": "r2-q-t",
    "section_type": "verse",
    "round": 2,
    "learning_objective": "retrieval-action",
    "letters": [
      "Q",
      "R",
      "S",
      "T"
    ],
    "line_count": 4,
    "rhyme_scheme": "refrain-driven",
    "motif_id": "season-wheel-retrieve",
    "energy_level": "medium-high",
    "response_frame": "one to two predictable beats of retrieval space before target confirmation",
    "refrain_or_chorus_identity": null,
    "tempo_bpm": 88,
    "density_override_evidence": null,
    "notes": "Letter cue precedes target; object reveal waits for target-word onset."
  },
  {
    "section_id": "r2-u-x",
    "section_type": "verse",
    "round": 2,
    "learning_objective": "retrieval-action",
    "letters": [
      "U",
      "V",
      "W",
      "X"
    ],
    "line_count": 4,
    "rhyme_scheme": "refrain-driven",
    "motif_id": "season-wheel-retrieve",
    "energy_level": "medium-high",
    "response_frame": "one to two predictable beats of retrieval space before target confirmation",
    "refrain_or_chorus_identity": null,
    "tempo_bpm": 88,
    "density_override_evidence": null,